{
  "schema": "locaily.development.validation_result.v1",
  "id": "validation-20260823T174000-issue37",
  "milestoneId": "dev-harness-01-agent-operations-contract",
  "profileId": "pre-delivery",
  "status": "passed",
  "gitState": {
    "branch": "fix/dev-harness-01-delivery-review-20260823",
    "headCommit": "ee5df0011ececbe55bcfb9d680900748b10c762a",
    "fingerprint": "sha256:e3b0c44298fc1c14",
    "changedFiles": [],
    "computedAt": "2026-08-23T17:35:00.000Z"
  },
  "startedAt": "2026-08-23T17:34:00.000Z",
  "completedAt": "2026-08-23T17:35:00.000Z",
  "results": [
    {
      "id": "harness-tests",
      "command": "node scripts/test-harness-adapters.js",
      "status": "passed",
      "exitCode": 0,
      "durationMs": 0,
      "summary": "31 passed, 0 failed"
    },
    {
      "id": "dev-status-strict",
      "command": "node scripts/dev-status.js --strict",
      "status": "passed",
      "exitCode": 0,
      "durationMs": 0,
      "summary": "No error or critical contradictions; DEV-LOOP-01 warning remains documented"
    },
    {
      "id": "schema-tests",
      "command": "node scripts/test-development-schemas.js",
      "status": "passed",
      "exitCode": 0,
      "durationMs": 0,
      "summary": "29 passed, 0 failed"
    },
    {
      "id": "lifecycle-tests",
      "command": "node scripts/test-lifecycle.js",
      "status": "passed",
      "exitCode": 0,
      "durationMs": 0,
      "summary": "23 passed, 0 failed"
    },
    {
      "id": "controller-tests",
      "command": "node scripts/test-controller-invariants.js",
      "status": "passed",
      "exitCode": 0,
      "durationMs": 0,
      "summary": "11 passed, 0 failed"
    },
    {
      "id": "contract-tests",
      "command": "node scripts/contract-test.js",
      "status": "passed",
      "exitCode": 0,
      "durationMs": 0,
      "summary": "Contract helpers passed"
    }
  ],
  "manualChecks": [
    {
      "id": "review-gate",
      "description": "Code review must pass (agent-review.js)",
      "acknowledged": true,
      "acknowledgedBy": "Codex",
      "acknowledgedAt": "2026-08-23T17:37:02.401Z"
    },
    {
      "id": "closeout-verified",
      "description": "Closeout record correctly describes completed work",
      "acknowledged": true,
      "acknowledgedBy": "Codex",
      "acknowledgedAt": "2026-08-23T17:37:02.401Z"
    }
  ],
  "warnings": [
    "The npm wrapper commands requested by issue #37 could not start in this runtime; their underlying node scripts passed directly.",
    "Windows-specific verification was not run.",
    "DEV-LOOP-01 remains planned while PR #30 is open and dirty; no lifecycle change was inferred."
  ],
  "error": null
}
